{
  "$schema": "https://json-schema.org/draft/2020-12/schema",
  "$id": "https://retrospec.dev/schema/epoch.schema.json",
  "title": "RETROSPEC Epoch",
  "description": "Schema for historical eras in RETROSPEC. Epochs are the 'chapters' of AI history, each representing a distinct period with its own themes, breakthroughs, and characteristics.",
  "type": "object",
  "required": ["id", "type", "name", "number", "date_start", "summary", "key_events", "key_figures", "defining_characteristics", "significance"],
  "properties": {
    "id": {
      "type": "string",
      "pattern": "^epoch_[0-9]{2}_[a-z_]+$",
      "description": "Unique ID: epoch_XX_name"
    },
    "type": {
      "const": "epoch"
    },
    "name": {
      "type": "string",
      "description": "Human-readable name of the epoch"
    },
    "number": {
      "type": "integer",
      "minimum": 0,
      "maximum": 10,
      "description": "Sequential epoch number (0-10)"
    },
    "date_start": {
      "type": "string",
      "format": "date",
      "description": "Start date of the epoch (ISO 8601)"
    },
    "date_end": {
      "type": ["string", "null"],
      "format": "date",
      "description": "End date of the epoch, or null if ongoing"
    },
    "summary": {
      "type": "string",
      "minLength": 50,
      "description": "Rich summary of the epoch — what defined it, what changed, why it matters"
    },
    "key_events": {
      "type": "array",
      "items": { "type": "string", "pattern": "^evt_" },
      "description": "IDs of the most significant events in this epoch"
    },
    "key_figures": {
      "type": "array",
      "items": { "type": "string", "pattern": "^person_" },
      "description": "IDs of the most influential people in this epoch"
    },
    "key_models": {
      "type": "array",
      "items": { "type": "string", "pattern": "^model_" },
      "description": "IDs of notable models from this epoch"
    },
    "key_concepts": {
      "type": "array",
      "items": { "type": "string" },
      "description": "Core concepts that emerged or matured in this epoch"
    },
    "defining_characteristics": {
      "type": "array",
      "items": { "type": "string" },
      "minItems": 1,
      "description": "What made this epoch distinct from those before and after it"
    },
    "preceded_by": {
      "type": ["string", "null"],
      "description": "ID of the previous epoch, or null for the first"
    },
    "succeeded_by": {
      "type": ["string", "null"],
      "description": "ID of the next epoch, or null for the current/last"
    },
    "significance": {
      "type": "integer",
      "minimum": 1,
      "maximum": 10,
      "description": "How transformative this epoch was for the overall trajectory of AI"
    }
  },
  "additionalProperties": false
}
